






































 

 

 

 

 

 

 

 

 

 

 

 

 

 

 

 

 

 

 

 

 

 

 

 

 

 

 

 

 

 

 

 

 

 

 

 

 

미국채, 유동성 그리고  

펀드 자금의 삼각관계 

20 Aug. 2013 

미국채 시장의 변동성이 지속적으로 확대되는 모습. 최근 미

국 채무관리국(ODM)이 차입자문위원회(TBAC)에 제출한 

리포트에 시장 변동성 확대의 몇 가지 단서를 찾을 수 있었

음. 결론은 연준의 정책 대응으로 시장 유동성은 풍부해졌지

만 일련의 구조적 변화들이 시장의 깊이는 더하지 못하면서 

정책 되돌림에 취약성을 노출시키고 있다는 것. 

예상 금리 레인지: 국고3년 2.96~3.04%, 국고5년 

3.31~3.39%, 국고 10년 3.70~3.79% 

1 미국채 금리 변동성 확대 
전일 미국채 시장은 경제지표 공백 속 속도조정에 대한

기대와 달리 연준 자산매입 축소에 대한 시장 우려를 반

영하며 추가적인 금리 상승 흐름이 뒤따랐다. 미국채 

10Y 2.88%, 연 초 대비 110bp 이상 급등한 금리 레벨

이 말해 주듯 미국채 시장은 변동성 확대와 함께 금리 

하단이 점진적으로 상승하고, 금리 상단이 추가적인 상

승 가능성에 노출되어 있는 약세 흐름에서 쉽게 벗어나

지 못하는 모습이다. 국내 채권 시장 역시 단기적으로 

시장 금리가 큰 폭으로 상승 하면서 가격 메리트를 부각

시키고 있지만 금리 방향성에 대한 확신이 어렵고, 미국

채 시장의 흔들림이 진정되지 않는 이상 매수 심리의 큰 

회복을 기대하기는 어려워 보인다.  

2 TBAC 
Treasury Borrowing Advisory Committee, 국내에서

미 재무부 차입자문위원회로 통용되고 있는 다소 생소

할 수 있는 이 기구는 SIFMA(Securities Industry 

and Financial Markets Association) 내 감독 위원회

로 재무부와 매 분기 전반적인 미국 경제에 대한 판단 

및 부채 관리와 관련한 제반의 권고사항을 제공하는 역

할을 맡고 있다. 차입자문위원회 멤버는 미국채 포지션

을 대량으로 보유하고 있는 각 투자회사 및 은행들의 대

표로 구성되며 현재 의장은 Dodge & Cox 펀드 대표 

Dana Emery, 부의장은 BNY Mellon의 CEO Curtis 

Arledge 이며 PIMCO, BlackRock, Credit Suisse, 

RBS, Citigroup, Bank of America, Morgan Stanley, 

JP Morgan Chase & Co. 등이 멤버로 참여하고 있다.  

 

3 미국 채권시장 유동성 평가 
“적기에 낮은 비용으로”라는 슬로건은 모든 자금 조

달의 핵심적인 부분이다. 이를 위해 미 재무부는 정기적

으로 예측 가능한 국채 발행을 정해두는 대신 매 분기 

자금 조달 여건을 점검함으로써 예기치 않은 상황 변화

에 대한 대응 전략을 수립하고 있다. 7월 31일 미국 채

무관리국(ODM)은 FY 3Q(4/1~ 6/30) 분기 리펀딩 

보고서를 TBAC에 제출했다. 프리젠테이션 형식으로 

작성된 보고서 내용 중 채권시장 유동성 평가
(Assessing fixed income market liquidity) 부분에서 
최근 연준 정책 변경 가능성에 따른 미국채 시장의 높은 

변동성을 이해하는 몇 가지 단서를 찾을 수 있었다. 

첫째, 2009년 이후 미국 내 유동성은 국채로 향했지만, 

정작 안정적 투자기반이라 할 수 있는 뮤추얼펀드 자금

은 미국채를 일관되게 외면해 왔다(Fig. 1, 2 참조). 둘

째, Fed의 자산매입 정책으로 전체 순발행 채권 규모가 

지속적으로 감소했으며, 미국채 금리 하락은 물론 주가 

상승, 크레딧 스프레드 축소에 연준 정책 효과가 나타났

다(Fig. 3, 4 참조). 셋째, 최근 크레딧 스프레드가 기업

의 펀더멘탈을 제대로 반영하지 못하면서 연준 자산매

입 축소라는 정책 되돌림에 의한 또 다른 시장 변동성에 

노출되어 있다(Fig. 5, 6 참조).  

4 풍부한 유동성이 시장 깊이는 더하지 못해 
미 채무관리국의 보고서는 앞선 위 세가지 유동성에 대

한 평가와 더불어 연준 자산매입 정책이 전체 시장 유동

성 공급을 늘렸지만 동시에 일련의 구조적 변화들이 시

장의 깊이를 더하지 못한 결과 연준 정책 변경에 따른 

시장 취약성을 노출시켰다는 한계를 지적했다. 이는 비

단 미국채 시장으로 국한되는 문제는 아닐 것이다. 국내 

채권시장 역시 풍부한 유동성과 정책 기대를 배경으로 

올 상반기까지 강세를 이어왔지만 연준 자산매입 축소

라는 외부 변화에 맞닥뜨리면서 시장 깊이의 한계를 드

러내는 모습이다. 결국 높은 시장 변동성이 한동안 해소 

되기 어렵다는 전망은 채권 시장의 깊이를 더하는 전통

적 투자자들의 투자 의사 결정을 지연시키는 동시에 단

기 투자기관들의 보수적 전망을 강화시키며 매수 심리 

위축 기간의 연장으로 이어질 가능성이 커 보인다. 



 

 2 Page 

 

 

Fig. 1 美 채권시장 회전율, 국채 비중 확대  Fig. 2 미국채 뮤추얼 펀드 판매 감소(net, $bn) 

 

 

 

Source: 미 재무부 자료 재인용  Source: 미 재무부 자료 재인용 

 

Fig. 3 Fed 매입분 제외 시 채권 순발행 감소 지속  Fig. 4 Fed 채권 보유량 및 크레딧 스프레드 추이 

 

 

 

Source: 미 재무부 자료 재인용  Source: 미 재무부 자료 재인용 

 

Fig. 5 美 신용 스프레드(IG) vs. 기업 레버리지배율  Fig. 6 美 회사채 펀드 자산 vs. PD 포지션($bn) 

 

 

 

Source: 미 재무부 자료 재인용  Source: 미 재무부 자료 재인용,  

 

본 자료는 고객의 투자 판단을 돕기 위해 작성된 참고용 자료입니다. 본 자료는 조사분석 

담당자가 신뢰할 수 있는 자료 및 정보를 토대로 작성한 것이나, 제공되는 정보의 완전성

이나 정확성을 당사가 보장하지 않습니다. 모든 투자의사결정은 투자자 자신의 판단과 책

임하에 하시기 바라며, 본 자료는 투자 결과와 관련한 어떠한 법적 분쟁의 증거로 사용될 

수 없습니다. 본 자료는 당사의 저작물로서 모든 저작권은 당사에 있으며, 당사의 동의 없

이 본 자료를 무단으로 배포, 복제, 인용, 변형할 수 없습니다. 



