






























 

 

 

 

 

 

 

 

 

 

 

 

 

 

 

 

 

 

 

 

 

 

 

 

 

 

 

 

 

 

 

 

 

 

 

 

 

Bend or Break, 

불확실성 기간의 연장 

4 Oct. 2013 

미국 정부 폐쇄 3일째. 주식시장이 사태 장기화 부담을 반영

하고 금리 또한 하락 중이나 시장 변동성은 제한적. 정치 교

착상태, 결국 해소될 수 밖에 없다는 기대, 과거 정치 리스

크 헤지 포지션이 비용만을 추가했던 학습 효과가 비교적 차

분한 시장 흐름의 배경. 미국 디폴트 가능성 희박하다면 결

국 일시적 재료에 의한 굽힘이 우세한 국면으로 판단. 캐리 

관점 유지. 예상 금리 레인지: 국고3년 2.77~2.87%, 국고5

년 3.00~3.10%, 국고 10년 3.35~3.45% 

1 정부 폐쇄 3일째 
미국 정부기능 부분 페쇄가 시작된 지 3일이 지났다. 오

바마 대통령은 정부 폐쇄가 해결되기 전에는 어떠한 협

상도 없다는 입장을 밝히는 등 정치권 내 교착 상황은 

아직까지 별 다른 진전을 이루지 못하고 있다. 다행인 

것은 금융시장이 비교적 차분함을 잃지 않고 있다는 점

인데 연방정부 폐쇄 기간이 예상과 달리 장기화될 가능

성을 우려하면서도 결국은 해결될 수 밖에 없을 것이라

는 기대감은 가격 변수의 변동성을 제한된 범위 내로 머

물게 하고 있다.  

휴일을 포함 밤 사이 S&P500 지수는 ADP 민간고용 

지표, ISM 서비스업 지표 부진과 정부 폐쇄 우려, 워싱

턴 의회에서의 총격 사건 등 악재 속에서 이틀 사이 

0.96% 하락했지만 미국채 금리는 10년물 기준 2.60% 

초반 레벨에 근접한 이후 추가 강세는 막히는 모습이다. 

정부 폐쇄 이후 정치권의 협상 테이블은 여전히 열려 있

고 합의점을 찾기 위한 노력도 계속될 것이다. 그러나 

쟁점이 되는 사안의 본질, 즉 건강보험 개혁안에 대한 

양 당의 입장은 정체성 문제와도 직결된다는 점에서 단

기간 내 극적인 반전이 나올 수 있을지에 대한 우려의 

시각 역시 쉽게 해소되지 못하고 있다. 

정치 불확실성에 대한 금융시장의 뚜렷한 대응책 역시 

마땅치가 않다. 일반적인 위험 요인이라면 그에 상응하

는 리스크 관리 수단을 강구하기 마련이지만 정치 리스

크는 이러한 일반적 접근이 어렵다. 과거 정치 리스크에 

대한 헤지 포지션이 대부분 비용만을 추가한 결과로 끝

났다는 학습효과뿐만 아니라 합의 결렬이 초래하게 될 

재앙적 사태를 감안하면 어떤 식으로건 정부 폐쇄 사태 

해소 및 부채한도 증액의 수순을 밟을 수 밖에 없을 것

이라는 기대를 배경으로 향후 사태 추이를 좀 더 지켜보

자는 관망심리가 우위를 점하고 있는 것으로 보인다. 

2 
 

계기판 고장, 정상 주행 방해 

미국 노동부는 홈페이지를 통해 정부 폐쇄 기간 중 통계

지표의 업데이트를 중단한다는 내용을 공지했다(Fig. 1

참조). 우려했던 대로 9월 고용보고서 발표는 정부 폐쇄 

사태가 해결된 이후로 미뤄지게 되었다.  

지표 발표 공백은 고용지표로 국한되지 않는다. 이미 

10월 1일로 예정되었던 건설지출 결과가 연기된 이후 

전일에는 공장주문 지표 역시 발표되지 못했다. 다음 주 

예정된 지표 중 무역수지와 JOLTs, 도매재고, 수입물

가 및 연방정부 예산, 소매판매, PPI, 기업 재고 등의 지

표가 정부 폐쇄로 인해 줄줄이 발표 연기될 것으로 알려

지고 있다. 

결국 미국 경제 상황에 대한 판단과 정책 의사 결정에 

필요한 통계 작성이 정상적으로 진행되기 어려워짐에 

따라 시장 역시 고장난 계기판을 달고 도로 위를 주행해

야하는 상황으로 내몰리고 있다. 주행속도가 얼마인지, 

오일과 냉각수 등 자동차 기능을 체크하는 전반적인 계

기 기능이 떨어진 상황에서 속도를 올리기란 쉽지가 않

을 것이다. 정치 불확실성이 지속될 경우 시장 흐름 역

시 지지부진한 상황이 이어질 것으로 예상된다. 

3 
 

채권시장, 불편하긴 마찬가지 

정부 폐쇄 기간이 예상보다 길어지고 주가지수를 비롯

한 위험자산 가격이 약세를 보이는 점은 단기적으로 채

권 시장에 우호적 요인으로 작용할 전망이다. 그러나 포

지션 운용 측면에서 현재 상황을 즐기고만 있기도 어려

워 보인다. 정치적 교착 상태는 결국 해소될 수 밖에 없

을 것이고 그에 따르게 될 반작용을 감안한다면 방향성

에 대한 확신도 약해질 수 밖에 없기 때문이다.  

굽거나(bend) 부러지거나(break). 정부 폐쇄의 장기화

와 부채한도 증액 협상 결렬로 인한 디폴트 가능성이 희

박하다면 결국 일시적 재료에 의한 굽힘(bending)이 우

세한 국면이라는 판단이다. 언젠가 해소되는 굽힘이지만 

그 강도 역시 제한되고 있다는 점에서 차익 실현 보다는 

기존 보유 물량에 대한 캐리 관점을 그대로 유지할 필요

가 있을 것으로 본다. 

 

 



 

 2 Page 

 

 
 

Fig. 1 미 노동부 홈페이지 통계 업데이트 중단 공지 

 

Source: http://www.bls.gov/home.htm 

 

Fig. 2 전일 장 중 이벤트에 따른 미 S&P 500 선물 및 미국채 10년물 금리 추이 

 

Source: Bloomberg 

 
본 자료는 고객의 투자 판단을 돕기 위해 작성된 참고용 자료입니다. 본 자료는 조사분석 

담당자가 신뢰할 수 있는 자료 및 정보를 토대로 작성한 것이나, 제공되는 정보의 완전성

이나 정확성을 당사가 보장하지 않습니다. 모든 투자의사결정은 투자자 자신의 판단과 책

임하에 하시기 바라며, 본 자료는 투자 결과와 관련한 어떠한 법적 분쟁의 증거로 사용될 

수 없습니다. 본 자료는 당사의 저작물로서 모든 저작권은 당사에 있으며, 당사의 동의 없

이 본 자료를 무단으로 배포, 복제, 인용, 변형할 수 없습니다. 



